{
  "chapter_number": 1,
  "chapter_title": "첫 번째 알림",
  "status": "final",
  "word_count_target": 5000,
  "word_count_actual": 4800,
  "meta": {
    "pov_character": "char_1",
    "characters": ["char_1"],
    "locations": ["loc_underpass"],
    "in_story_time": "1일차 22:10"
  },
  "context": {
    "previous_summary": "",
    "current_plot": "주인공은 퇴근 직후 정체불명의 앱 알림을 받는다. 알림은 17분 뒤 지하보도에서 한 사람이 죽는다고 예고하고, 수신자는 주인공 한 명뿐이다. 장난이라고 넘기려던 순간 알림 화면의 좌표가 과거 가족 실종 사건 자료에서 본 표식과 닮았다는 사실을 깨닫는다. 주인공은 경찰 신고와 이동 시간을 동시에 계산하지만, 신고만으로는 늦는다고 판단해 지하보도로 달려간다. 현장에는 아직 아무 일도 일어나지 않았지만, 알림 시간이 0이 되는 순간 조명이 꺼지고 첫 피해자가 발견된다. 피해자의 휴대폰에도 같은 앱이 설치되어 있으며, 화면에는 새 예고와 주인공 이름, 과거 미제 사건 번호가 현재 사건 기록과 함께 깜박인다.",
    "next_plot": "공식 신고 기록과 사무실 알리바이 경로가 사라져 안전한 제보자 선택지가 닫힌 여파로 경찰 의심 압박을 받는 주인공은 피해자 휴대폰의 알림 로그를 확인하고, 앱 로고가 과거 미제 사건 번호와 연결된 단서임을 발견한다."
  },
  "narrative_elements": {
    "foreshadowing_plant": ["fore_app_logo"],
    "foreshadowing_payoff": [],
    "hooks_plant": ["hook_first_receiver"],
    "hooks_reveal": [],
    "character_development": "주인공은 공포보다 패턴을 먼저 읽고 타인의 죽음을 막기 위해 위험한 현장으로 향한다.",
    "emotional_goal": "불길함, 지적 호기심, 즉각적 위기감"
  },
  "reader_experience": {
    "promise_fulfillment": "살인을 예고하는 앱이 주인공의 이름을 첫 번째 수신자로 지목한다. 범인이 메시지를 보내는 것이 아니라 앱이 아직 일어나지 않은 살인을 예보한다는 차별점을 첫 알림과 실제 피해자 발견으로 즉시 증명한다. 단서가 맞물리는 지적 쾌감과 위기 직전의 긴장감을 반복 보상으로 제공한다.",
    "chapter_reward": "앱 알림이 실제 사건과 맞아떨어지는 첫 규칙 증명",
    "page_turner_question": "앱은 왜 주인공에게만 첫 알림을 보냈고, 예고 앱은 실제 살인을 어떻게 알았는가?",
    "character_appeal_moment": "주인공이 경찰 신고보다 현장 도착 시간을 먼저 계산해 뛰쳐나간다.",
    "drop_off_risk": "앱 설명이 길어질 위험 — 알림, 이동, 현장 실패 순서로 규칙을 행동으로 보여준다.",
    "must_click_ending": "피해자의 휴대폰에서 새 예고가 뜨며 주인공 이름과 과거 미제 사건 번호가 현재 사건 기록에 함께 연결된다.",
    "cliffhanger_strength": 9
  },
  "scenes": [
    {
      "scene_number": 1,
      "purpose": "예고 앱의 첫 알림과 주인공의 반응을 제시한다.",
      "characters": ["char_1"],
      "location": "loc_office",
      "conflict": "장난으로 넘길지, 위험을 감수하고 현장으로 갈지 선택해야 한다.",
      "beat": "앱 알림이 실제 사건과 맞아떨어지는 첫 규칙 증명, 주인공이 경찰 신고보다 현장 도착 시간을 먼저 계산해 뛰쳐나간다. 그는 제한 시간 안에 피해자를 구하지 못하면 사망 예고가 실제 죽음이 된다는 압박 속에서 복도 끝 엘리베이터 버튼을 누르고 지하보도 입구로 뛰쳐나간다. 그 대가로 공식 신고 기록과 사무실 알리바이 경로가 사라지고 안전한 제보자 선택지가 닫혔으며, 이후 경찰 의심을 부를 압박이 남는다. 알림, 이동, 현장 실패 순서로 규칙을 행동으로 보여준다. 단서가 맞물리는 지적 쾌감과 위기 직전의 긴장감을 만든다.",
      "emotional_tone": "불길함",
      "estimated_words": 2100
    },
    {
      "scene_number": 2,
      "purpose": "현장 실패 직후 앱 예고가 실제 사건과 연결됨을 증명한다.",
      "characters": ["char_1"],
      "location": "loc_underpass",
      "conflict": "주인공은 제한 시간 안에 피해자를 찾으려 하지만 누군가 통제선 조명을 꺼뜨리고 현장 철문을 안쪽에서 잠근 탓에 현장 기록과 피해자 휴대폰만 남는다.",
      "beat": "현장 실패 직후 첫 알림의 장소에서 실제 피해자가 발견된다. 누군가 통제선 조명을 꺼뜨리고 현장 철문을 잠근 방해 때문에 주인공은 정면 진입을 포기하고 피해자 휴대폰 로그와 현장 기록의 빈칸을 해석한다. 피해자의 휴대폰에서 새 예고가 뜨며 주인공 이름과 과거 미제 사건 번호가 현재 사건 기록에 함께 연결된다. 긴장이 재점화되고, 그는 피해자의 휴대폰을 움켜쥔 채 숨을 삼키며 다음 수신자로 깜박이는 자기 이름을 다시 확인하려 화면을 눌렀다.",
      "emotional_tone": "긴장",
      "estimated_words": 2700
    }
  ],
  "style_guide": {
    "tone": "서늘하고 압축적인 도시 스릴러",
    "pacing": "fast",
    "focus": "앱 알림, 이동, 현장 실패를 통한 규칙 증명"
  }
}
