{
  "chapter_number": 2,
  "chapter_title": "두 번째 예고",
  "status": "final",
  "word_count_target": 5000,
  "word_count_actual": 5200,
  "meta": {
    "pov_character": "char_1",
    "characters": ["char_1", "char_support_1"],
    "locations": ["loc_underpass", "loc_records_room"],
    "in_story_time": "2일차 00:20"
  },
  "context": {
    "previous_summary": "주인공은 정체불명의 앱이 보낸 첫 살인 예고를 받고 현장으로 향했지만 피해자를 구하지 못했다. 피해자 휴대폰에서도 같은 앱과 주인공 이름이 발견되었다. 공식 신고 기록과 사무실 알리바이 경로가 사라져 안전한 제보자 선택지가 닫힌 여파로 경찰 의심 압박이 따라붙었다.",
    "current_plot": "공식 신고 기록과 사무실 알리바이 경로가 사라지고 안전한 제보자 선택지가 닫힌 탓에 경찰 의심을 받는 주인공은 조사망이 느슨해진 틈을 타 피해자 휴대폰의 알림 로그를 확인한다. 로그에는 삭제된 알림 하나와 앱 로고 파일명이 남아 있고, 그 파일명은 주인공이 오래전 가족 실종 사건 기록에서 본 미제 사건 번호와 일치한다. 조력자는 이것을 경찰에 넘기자고 하지만, 주인공은 경찰 내부에서도 같은 로고를 본 기억이 있다며 망설인다. 그 순간 두 번째 알림이 울리고, 대상 이름은 조력자의 별칭과 일치한다. 예고 시간은 이미 시작된 뒤이며, 위치 반경은 주인공 바로 옆 건물로 좁혀진다. 앱 로고의 과거 미제 사건 번호는 새 예고와 현재 사건 기록에 다시 연결된다.",
    "next_plot": "주인공은 조력자를 데리고 예고 위치로 향하지만, 앱은 두 사람의 이동을 이미 알고 있는 듯 경로를 바꾼다."
  },
  "narrative_elements": {
    "foreshadowing_plant": ["fore_app_logo"],
    "foreshadowing_payoff": [],
    "hooks_plant": ["hook_second_target"],
    "hooks_reveal": ["hook_first_receiver"],
    "character_development": "주인공은 공포보다 패턴을 먼저 읽고, 과거 가족 실종 사건을 숨기려다 조력자를 구하기 위해 위험을 감수해 약점을 공개한다.",
    "emotional_goal": "추리 쾌감, 관계 긴장, 절박함"
  },
  "reader_experience": {
    "promise_fulfillment": "살인을 예고하는 앱이 주인공의 이름을 첫 번째 수신자로 지목한다. 두 번째 회차는 범인이 메시지를 보내는 것이 아니라 앱이 아직 일어나지 않은 살인을 예보한다는 차별점과 과거 미제 사건 연결을 단서로 확장한다. 단서가 맞물리는 지적 쾌감과 위기 직전의 긴장감을 반복 보상으로 제공한다.",
    "chapter_reward": "첫 알림 로그에서 앱 로고와 과거 미제 사건 번호가 일치한다는 단서 발견",
    "page_turner_question": "예고 앱은 실제 살인을 어떻게 알고 조력자를 두 번째 대상으로 좁혔는가?",
    "character_appeal_moment": "주인공이 공포보다 패턴을 먼저 읽고 위험을 감수해 조력자를 구하려 자신의 과거 약점을 공개한다.",
    "drop_off_risk": "조사 장면이 정적으로 보일 위험 — 로그 분석 중 실시간 알림 카운트다운을 병치한다.",
    "must_click_ending": "두 번째 예고 대상의 위치가 주인공 바로 옆 건물로 좁혀지고, 앱 로고의 과거 미제 사건 번호가 새 예고와 현재 사건 기록에 다시 연결된다.",
    "cliffhanger_strength": 8
  },
  "scenes": [
    {
      "scene_number": 1,
      "purpose": "피해자 휴대폰 로그에서 앱 로고와 미제 사건 번호의 연결을 찾는다.",
      "characters": ["char_1", "char_support_1"],
      "location": "loc_records_room",
      "conflict": "공식 신고 기록과 사무실 알리바이 경로가 사라져 경찰 의심을 받는 주인공은 증거를 경찰에 넘길지, 직접 추적할지 갈등한다.",
      "beat": "안전한 제보자 선택지가 닫힌 여파로 경찰 감시가 따라붙는 가운데 첫 알림 로그에서 앱 로고와 과거 미제 사건 번호가 일치한다는 단서 발견, 주인공이 공포보다 패턴을 먼저 읽고 위험을 감수해 조력자를 구하려 자신의 과거 약점을 공개한다. 그 직후 비밀을 숨길 선택지가 닫히고 조력자와의 관계 안전거리가 사라진다. 그가 약점을 공개하자 조력자의 의심이 멈추고 두 번째 예고를 함께 추적하기로 동행한다. 로그 분석 중 실시간 알림 카운트다운을 병치한다. 단서가 맞물리는 지적 쾌감과 위기 직전의 긴장감을 만든다.",
      "emotional_tone": "추리",
      "estimated_words": 2600
    },
    {
      "scene_number": 2,
      "purpose": "첫 단서의 결과 두 번째 예고의 대상이 주인공의 조력자로 드러난다.",
      "characters": ["char_1", "char_support_1"],
      "location": "loc_underpass",
      "conflict": "첫 단서의 결과 예고 앱이 기록실 출입문을 잠그고 두 번째 알림을 보내 이미 시작된 예고 시간 안에 조력자를 안전한 곳으로 옮겨야 한다.",
      "beat": "그 결과 예고 앱이 기록실 출입문을 잠그고 두 번째 알림을 보낸다. 두 번째 예고 대상의 위치가 주인공 바로 옆 건물로 좁혀지고, 앱 로고의 과거 미제 사건 번호가 새 예고와 현재 사건 기록에 다시 연결된다. 붉은 앱 로고가 어두운 화면에서 깜박이자 그는 조력자의 팔을 붙잡고 숨을 삼킨 채, 바로 옆 건물로 좁혀지는 표적 좌표를 다시 확인하려 화면을 눌렀다.",
      "emotional_tone": "절박함",
      "estimated_words": 2600
    }
  ],
  "style_guide": {
    "tone": "차갑고 집요한 추적극",
    "pacing": "medium",
    "focus": "단서 해석과 실시간 카운트다운의 병치"
  }
}
